date_iso	register	template	opener_type	close_type	headline
2026-06-11	The Ledger	Finding-First / Claim-First Build	Flat-fact / finding-first	Status (left in current status)	Two Straight Years Past 2,000
2026-06-12	The Ledger	Finding-First / Claim-First Build (10)	Flat-fact / finding-first	Status (matter left in its current status; open question, no button)	Inflation Climbs to a Three-Year High, Driven Mostly by Energy
2026-06-12	The Open Letter	Withheld-Turn (8)	Vocative self-lowering address anchored to the precipitating event	Concrete request and condition handed to the addressee	Say Earth Orbit First: A Letter to NASA
2026-06-12	The Reckoning	Antithesis-as-Engine (Template 2)	Address / occasion	Charge / obligation	Full Price for an Empty Camp
2026-06-12	The Long Look	Accumulation under a Repeated Frame (3)	Flat-fact / finding-first	Culminating accumulation (close on the complexity itself)	The Seam Between Day and Night
2026-06-12	The Long Think	Concession-then-Rebuttal (1)	Concede-first	Inward turn	Stored, Not Kept
2026-06-12	The Tribute	Narrative-into-Claim (5)	In-scene	Placement-into-permanence / benediction	The Voice That Carried
